,sent_src,score_src,sum_src,sent_tgt,score_tgt,sum_tgt,score_diff,sum_diff,diff_pos
489,"The FCC said existing televisions, VCRs, DVD players and related equipment would remain fully functional under the new broadcast flag system.",[0 1 0 0 0],1,"It also required that existing televisions, VCRs, DVD players and related equipment will remain fully functional under the new broadcast flag system.",[0 0 0 0 0],0,1,1,1
491,"For the third time in the past four years, wildfires are the problem.",[1 1 0 1 0],3,It was the third time in four years that wildfires forced the park to close.,[1 1 0 0 0],2,1,1,3
498,"The Leader of the Opposition, Simon Crean, said from Jakarta that the reshuffle had been forced by ministerial incompetence.",[1 0 0 1 0],2,"The Opposition Leader, Simon Crean, said John Howard had been forced to make changes by the incompetence of his ministers.",[1 0 0 0 0],1,1,-1,3
504,"The cleanup, including new carpeting, electrical wiring and bathrooms, cost about $130 million.",[1 1 0 0 1],3,"The $130 million cleanup included new carpet, electrical wiring and bathrooms.",[1 1 0 0 0],2,1,1,4
510,"DUBAI, SEPTEMBER 23:  The world economic leaders hailed on Tuesday signs of a global revival but agreed it had to be handled with care to prevent any setback.",[1 1 1 0 0],3,World economic leaders hailed signs of a global revival on Tuesday but agreed it had to be handled with care to prevent any setback.,[1 1 0 0 0],2,1,-1,2
527,"The judge ordered the unsealing yesterday at the request of several news agencies, including The Seattle Times, The Associated Press and the Seattle Post-Intelligencer.",[1 1 0 0 0],2,"The depositions were made public yesterday at the request of the P-I, The Seattle Times and The Associated Press.",[0 1 0 0 0],1,1,1,0
536,"""This is the time we priests need to be renewing our pledge to celibacy, not questioning it,"" he wrote.",[0 0 0 1 0],1,"He says that ""this is a time when we priests need to be renewing our pledge to celibacy, not questioning it.",[0 0 0 0 0],0,1,-1,3
550,The Democratic Republic of Congo's war began in 1998 when Uganda and Rwanda invaded together to back rebels trying to topple Kinshasa.,[1 1 0 0 0],2,Congo's war began in 1998 when Uganda and Rwanda invaded to back rebels fighting to topple the central government.,[0 1 0 0 0],1,1,-1,0
551,"Jane Doe, deciding to fight the subpoena, asked Verizon to withhold her name.",[0 0 0 0 1],1,She said Jane Doe's lawyers asked Verizon to withhold her name because she was planning on challenging the subpoena.,[0 0 0 0 0],0,1,-1,4
554,"University of Michigan President Mary Sue Coleman said in a statement on the university's Web site, ""Our fundamental values haven't changed.",[0 1 0 1 0],2,"""Our fundamental values haven't changed,"" Mary Sue Coleman, president of the university, said in a statement in Ann Arbor.",[0 1 0 0 0],1,1,1,3
557,"A base configuration with a 2.0GHz Intel Celeron processor, 128M bytes of memory, a 40G-byte hard drive, and a CD-ROM drive costs US$729.",[1 1 1 0 1],4,"A base configuration with a 2.4GHz Pentium 4, 128MB of RAM, a 40GB hard drive, and a CD-ROM drive costs $699.",[1 1 1 0 0],3,1,1,4
561,"""The releases are the latest in a series of efforts by the government to move Myanmar closer to multiparty democracy and national reconciliation,"" a government statement said.",[1 1 0 1 0],3,"""The releases are the latest in a series of efforts by the government to move Myanmar to multi-party democracy and national conciliation.""",[1 1 0 0 0],2,1,-1,3
569,Lakhani was charged with attempting to provide material support and resources to a terrorist group and acting as an arms broker without a license.,[0 1 0 0 0],1,"He was charged with attempting to provide material support and resources to terrorists, and dealing arms without a licence.",[0 0 0 0 0],0,1,1,1
574,Some are also used to send spam e-mail messages to boost traffic to the sites.,[1 1 0 0 0],2,Some of the computers also are used to send spam e-mail messages to drum up traffic to the sites.,[0 1 0 0 0],1,1,-1,0
575,"It also faces significant regulatory delays and uncertainty, and threatens serious damage to the company's business, he added.",[0 0 0 1 0],1,"""It is highly conditional, faces significant regulatory delays and uncertainty, and threatens serious damage to our business.""",[0 0 0 0 0],0,1,1,3
591,"But SCO has hit back, saying: ""We view IBM's counterclaim filing today as an effort to distract attention from its flawed Linux business model.",[1 1 0 0 0],2,"In a statement, an SCO spokeman said, ""We view IBM's counterclaim filing today as an effort to distract attention from its flawed Linux business model.",[0 1 0 0 0],1,1,1,0
599,"""If the voluntary reliability standards had been complied with, we wouldn't have had a problem,"" Mr. Dhaliwal said.",[0 0 0 1 0],1,"""If the voluntary reliability standards were complied with, we wouldn't have had a problem.""",[0 0 0 0 0],0,1,-1,3
602,"That would represent an increase of some 10 per cent from the year before, it added.",[0 0 0 1 0],1,If achieved it would represent an increase of 10 per cent from the same quarter a year ago.,[0 0 0 0 0],0,1,-1,3
603,"The company posted a net loss of $185 million, or 54 cents per share, in the year-earlier period, it said in a statement Wednesday.",[0 1 0 0 0],1,"In the second quarter last year, the company experienced a net loss of $185 million, or 54 cents a share, on sales of $600 million.",[0 0 0 0 0],0,1,-1,1
606,"""Further testing is still under way, but at this stage, given the early detection, the outlook in such instances would be positive,"" the specialist said yesterday.",[1 1 0 1 0],3,"A spokesman said: ""Further testing is under way but at this stage, given the early detection, the outlook is positive.""",[1 1 0 0 0],2,1,-1,3
611,"Dick is going to be there as long as Dick wants to be there,"" Reuters reports Langone as saying.",[0 1 0 1 0],2,"""Dick is going to be there as long as Dick wants to be there.""",[0 1 0 0 0],1,1,1,3
620,"The fire has so far charred 11,400 acres on Mount Lemmon just north of Tucson, and more than 250 homes have been destroyed.",[0 0 0 1 0],1,"The Aspen Fire had charred more than 12,400 acres by today on Mount Lemmon just north of Tucson, and more than 250 homes had been destroyed.",[0 0 0 0 0],0,1,-1,3
624,"After serving as a marine in World War II, he began submitting articles to magazines.",[0 0 0 1 0],1,He served as a marine in the Second World War and afterward began submitting articles to magazines.,[0 0 0 0 0],0,1,-1,3
631,"""It will be a compromise, like the real world requires,"" he said.",[0 0 0 1 0],1,"Mr. Bloomberg later told reporters that the agreement ""will be a compromise, like the real world requires.""",[0 0 0 0 0],0,1,-1,3
646,"At 12, Lionel Tate was charged with first-degree murder over the death of Tiffany Eunick.",[1 1 0 0 0],2,"Tate was 12 when he was charged with beating Tiffany Eunick, 6, to death in July 1999.",[0 1 0 0 0],1,1,1,0
648,"If the MTA's appeal to a higher court is successful, the $2 bus and subway base fare won't be rolled back.",[1 1 0 1 0],3,"If the MTA's appeal is successful, the $2 bus and subway base fare won't change.",[1 1 0 0 0],2,1,1,3
649,"Chante Jawaon Mallard, 27, is charged with murder and tampering with evidence.",[0 1 0 0 0],1,"Now, nearly two years later, Mallard prepares for trial on charges of murder and tampering with evidence.",[0 0 0 0 0],0,1,-1,1
650,"In Nairobi, Kenya, the Very Rev. Peter Karanja, provost of All Saints Cathedral, said the U.S. Episcopal Church ""is alienating itself from the Anglican Communion.""",[0 0 0 1 0],1,"The Episcopal Church ''is alienating itself from the Anglican Communion,'' said the Very Rev. Peter Karanja, provost of the All Saints Cathedral, in Nairobi.",[0 0 0 0 0],0,1,1,3
663,Florida’s Third District Court of Appeal said on Wednesday the original proceedings were “irretrievably tainted” by misconduct by attorneys for the class.,[1 0 0 1 0],2,"Florida's Third District Court of Appeal saidon Wednesdaythe original proceedings were ""irretrievably tainted"" by misconduct by lawyers representing the class.",[1 0 0 0 0],1,1,-1,3
671,"The day after Wilkie resigned, Howard said in a televised address that Iraq possessed ""chemical and biological weapons capable of causing death and destruction on a mammoth scale"".",[0 0 0 1 0],1,"In a televised address back in March, Mr Howard declared Iraq had weapons capable of ""causing death and destruction on a mammoth scale"".",[0 0 0 0 0],0,1,1,3
686,"""We've put a lot of effort and energy into improving our patching progress, probably later than we should have.",[0 0 0 1 0],1,"""We have put a lot of energy into patching, later than we should have,"" he said.",[0 0 0 0 0],0,1,1,3
699,"But Odette is the first to form over the Caribbean Sea in December, the Center said.",[1 1 0 1 0],3,It is the first named storm to develop in the Caribbean in December.,[1 1 0 0 0],2,1,1,3
700,"Announced last week, Apple's iTunes Music Store has sold over 1 million songs in the first week, the company announced on Monday.",[0 0 0 1 0],1,"Apple Computer's new online music service sold more than 1 million songs during its first week of operation, the company said Monday.",[0 0 0 0 0],0,1,1,3
705,"Like the Power4, the Power5 contains two processor cores on one chip.",[1 0 0 0 0],1,"Power5, like Power4, includes two processor cores in a single slice of silicon.",[0 0 0 0 0],0,1,-1,0
710,But stocks have rallied sharply over the past 3-1/2 months amid hopes for an economic rebound later this year.,[1 1 0 0 0],2,But stocks have roared higher in the past 3-1/2 months amid hopes for an economic rebound.,[1 0 0 0 0],1,1,1,1
712,"SSE shares were little changed, up 0.3 percent at 654 pence by 1018 GMT, but analysts welcomed the move.",[1 1 0 1 0],3,SSE shares were unchanged at 652 pence by 0835 GMT but analysts welcomed the deal.,[1 1 0 0 0],2,1,1,3
713,"""There is no conscious policy of the United States, I can assure you of this, to move the dollar at all,"" he said.",[0 0 0 1 0],1,He also said there is no conscious policy by the United States to move the value of the dollar.,[0 0 0 0 0],0,1,1,3
722,He was reported as saying Prime Minister Sir Allan Kemakeza had made a deal with him to keep his guns while notorious warlord Harold Keke's group was armed.,[0 1 0 0 0],1,He reportedly claims Prime Minister Sir Allan Kemakeza had made a deal with him to keep his guns while Harold Keke's group was armed.,[0 0 0 0 0],0,1,-1,1
724,"In an unusual move that critics contend could disrupt millions of Web sites, the U.S. Patent and Trademark Office is reconsidering a patent affecting Internet pages.",[1 1 0 1 0],3,"In an unusual move, the U.S. Patent and Trademark Office is reconsidering a patent affecting Internet pages that critics contend could disrupt millions of Web sites.",[1 1 0 0 0],2,1,-1,3
729,"Newisys, an Austin, Texas, startup headed by former IBM and Dell execs, will become a wholly-owned subsidiary.",[1 1 0 0 1],3,"According to Sanmina-SCI, Newisys, based in Austin, Texas, will become a wholly-owned subsidiary.",[1 1 0 0 0],2,1,-1,4
736,"But waiting crowds filling the streets rushed the bridges soon after daylight, overrunning razor-wire barricades.",[0 1 0 0 0],1,"Waiting crowds filling the streets on both sides overwhelmed the peacekeepers soon after daylight, sweeping past the barbed wire barricades.",[0 0 0 0 0],0,1,-1,1
747,"Jeter, who dislocated his left shoulder in a collision March 31, took batting practice on the field for the first time Monday.",[0 1 0 0 1],2,He took batting practice on the field for the second time Tuesday since his opening-day injury.,[0 1 0 0 0],1,1,-1,4
752,"""Mr Gilbertson would have been entitled to these superannuation payments irrespective of ... (how) he left the company,"" Mr Argus said.",[0 0 0 1 0],1,"""Mr Gilbertson would have been entitled to these (pension) payments irrespective of the circumstances in which he left the company,"" Mr Argus said.",[0 0 0 0 0],0,1,1,3
754,"Graham said the surgery was not exactly the way to begin a campaign, but he is recovered.",[0 0 0 1 0],1,"Graham acknowledged that surgery was not exactly the way to begin a campaign, but he said he feels strong and has the go-ahead from his doctors.",[0 0 0 0 0],0,1,1,3
757,"""September and third quarter data confirm that demand in the global semiconductor market is rising briskly,"" stated SIA President George Scalise, in a statement.",[0 0 0 1 0],1,"""September and third-quarter data confirm that demand in the global semiconductor market is rising briskly,"" George Scalise, the SIA's president, said in the statement.",[0 0 0 0 0],0,1,-1,3
761,"""There is no conscious policy of the United States, I can assure you of this, to move the dollar at all,"" he said.",[0 0 0 1 0],1,"""There is no conscious policy on the part of the United States to move the dollar at all,"" Snow said.",[0 0 0 0 0],0,1,-1,3
762,"""Events on our system, in and of themselves, could not account for the widespread nature of the outage,"" FirstEnergy Chief Executive Peter Burg told the House panel.",[0 0 0 1 0],1,"""Events on our system, in and of themselves, could not account for the widespread nature of the outage,"" Burg said.",[0 0 0 0 0],0,1,1,3
765,The ambassador said it was up to the Americans to press the Iraqi council to make the invitation - a move he said the United States appears unwilling to make.,[1 1 0 1 0],3,"The ambassador said it was up to the Americans to press the Iraqis to make the invitation, which he said the United States appears unwilling to do.",[1 1 0 0 0],2,1,-1,3
786,"He had been in protective custody since being transferred to Souza-Baranowski in April, officials said.",[0 0 0 1 0],1,Mr. Geoghan had been living in a protective custody unit since being transferred to the prison on April 3.,[0 0 0 0 0],0,1,-1,3
807,"When the manager let him in the apartment, Brianna was in her mother's bedroom lying in a baby's bathtub, covered with a towel and watching cartoons.",[0 1 0 0 0],1,"When a manager let him into the apartment, the youngster was lying in a baby's bathtub, covered with a towel and was watching a TV cartoon channel.",[0 0 0 0 0],0,1,1,1
808,"ATA spokeswoman Diana Cronan said travel was down in May through July, and she also expects it to be down some over Labor Day.",[0 0 0 1 0],1,Air Transport Association spokeswoman Diana Cronan said that travel was down in May through July and that she also expected it to be off over Labor Day.,[0 0 0 0 0],0,1,-1,3
812,"Jordan Green, the prelate's private lawyer, said he had no comment.",[0 0 0 0 1],1,"O'Brien's attorney, Jordan Green, declined to comment.",[0 0 0 0 0],0,1,1,4
818,Representatives of abuse victims expressed dismay at the possibility.,[1 1 0 0 0],2,Representatives of abuse victims were dismayed by the development.,[1 0 0 0 0],1,1,-1,1
820,No company employee has received an individual target letter at this time.,[0 1 0 0 0],1,"She said no company official had received ""an individual target letter at this time.""",[0 0 0 0 0],0,1,1,1
827,"In 2002, the chairman of the Senate Judiciary Committee took in $18,009 from moonlighting as a songwriter, according to his latest Senate financial disclosure.",[1 1 0 0 0],2,"In 2002, Senator Trapdoor took in $18,009 from moonlighting as a songwriter, according to his latest Senate financial disclosure.",[0 1 0 0 0],1,1,1,0
829,"Computer Associates, EMC, IBM, Sun Microsystems, and VERITAS are also onboard to support the storage standard.",[1 1 0 0 1],3,"In addition to HP, vendors backing SMI-S include Computer Associates, EMC, IBM, Sun and Veritas.",[1 1 0 0 0],2,1,-1,4
830,Business groups and border cities have raised concerns that US-VISIT will mean longer lines that will damage cross-border commerce.,[1 1 0 0 0],2,Business groups and border cities have raised concerns that US-VISIT will mean longer waits to cross borders and will hurt commerce.,[0 1 0 0 0],1,1,-1,0
834,"The broad Standard & Poor's 500 Index .SPX shed 0.17 of a point, or just 0.02 percent, to 934.",[0 0 1 0 0],1,"The Standard & Poor's 500 Index lost 6.77, or 0.7 percent, to 927.62 as of 10:33 a.m. in New York.",[0 0 0 0 0],0,1,-1,2
838,"Revenue rose 26 percent, to $817 million, the company, based in South San Francisco, Calif., said.",[0 0 0 0 1],1,"Revenue jumped 26 percent to $817 million, the South San Francisco-based company said in a statement.",[0 0 0 0 0],0,1,-1,4
845,His decision was delayed by concerns over the budget process in Washington and the war in Iraq.,[1 0 0 0 0],1,Daniels told the Star April 20 he was holding back because of concerns over the budget process in Washington and the war in Iraq.,[0 0 0 0 0],0,1,1,0
846,Juries in state and federal cases alike have also grown reluctant to impose the death penalty.,[1 1 0 0 0],2,"In addition, juries in both state and federal cases have become increasingly reluctant to impose the death penalty.",[0 1 0 0 0],1,1,-1,0
849,"BT said it expected the combination to reap 60,000 additional customers between September and March, 2004.",[1 1 0 0 0],2,"BT said the combination would have an immediate impact on subscriptions with 60,000 additional customers between September and March, 2004.",[0 1 0 0 0],1,1,-1,0
860,"""His advice to the House Republicans is to pass it, to send it to him, so he can sign it.""",[1 0 0 1 0],2,"The president's ""advice to the House Republicans is to pass it, to send it to him, so he can sign it,"" said White House spokesman Ari Fleischer.",[0 0 0 1 0],1,1,1,0
861,"At his request, he will be reassigned within the district.",[0 1 0 0 0],1,District Superintendent J. Chester Floyd told reporters Monday that McCrackin will be reassigned within the district.,[0 0 0 0 0],0,1,1,1
862,"Worldwide, Les Misérables has been seen by over 50 million people, with a total gross of over $2 billion.",[1 0 0 0 0],1,"Worldwide, more than 50 million people have seen ""Les Miz,"" with gross receipts of $1.8 billion.",[0 0 0 0 0],0,1,-1,0
869,"In fact, said John Logsdon, a board member and George Washington University expert on space policy, ""human spaceflight had become a place where dissent was not welcome.""",[0 0 0 1 0],1,"John Logsdon, a board member, said that ""human spaceflight had become a place where dissent was not welcome.""",[0 0 0 0 0],0,1,-1,3
882,Parson has been charged on one count of intentionally causing or attempting to cause damage to a computer.,[0 1 0 0 0],1,Parson faces one federal count of intentionally causing damage to a protected computer.,[0 0 0 0 0],0,1,1,1
884,"The offer is also subject to Goldman signing an agreement with Drax's senior banks, senior bond holders and hedging banks by Sept. 30, it said.",[0 0 0 1 0],1,"The bank also said its offer was subject to the agreement of Drax's senior banks, senior bond holders and hedging banks by 30 September 2003.",[0 0 0 0 0],0,1,-1,3
885,"On Wednesday, Hill is scheduled to become the first person executed for murdering an abortion doctor.",[1 1 0 0 0],2,"Hill, 50, would be the first person executed for killing an abortion doctor.",[0 1 0 0 0],1,1,-1,0
887,"The Centers for Medicare and Medicaid Services, the federal agency that runs Medicare, last year began a similar effort for nursing homes.",[1 1 0 0 1],3,The Centers for Medicare and Medicaid launched a similar consumer tool for nursing homes last year.,[1 1 0 0 0],2,1,1,4
890,"The lawyer for Hollins Jr., Thomas Royce, has said his client had no link to the company that owned and operated E2.",[0 0 0 1 0],1,"Calvin Hollins Jr.'s attorney, Thomas Royce, has repeatedly said his client had no link with the company that owned and operated E2.",[0 0 0 0 0],0,1,-1,3
894,"""That ought to be the standard, not how many people actually signed up,"" Mr. Rule told the judge.",[0 0 0 1 0],1,"That ought to be the standard — not how many people sign up,"" he said.",[0 0 0 0 0],0,1,-1,3
900,Oracle's $19.50-a-share bid comes two days after PeopleSoft added cash to its original all-share deal with smaller rival J.D. Edwards & Co. JDEC.O .,[1 1 1 0 0],3,"The $19.50-a-share bid, comes two days after PeopleSoft revised its bid for smaller rival J.D. Edwards & Co. JDEC.O to include cash as well as stock.",[1 1 0 0 0],2,1,-1,2
901,"""[They] were defined by dedication and courage,"" said the CIA's director George Tenet.",[1 0 0 0 0],1,"CIA Director George Tenet said the two men were ""defined by dedication and courage.""",[0 0 0 0 0],0,1,-1,0
905,"Even the pizza delivery took part, unwittingly delivering a leaflet with the missing girl's picture during his run to Cruz's house.",[1 1 0 0 0],2,"Even the pizza man took part, delivering a flier with the missing girl's picture along with the pizza and a two-liter bottle of Pepsi to Cruz's house.",[0 1 0 0 0],1,1,-1,0
909,"Of all personal vehicles, 57 percent are cars or station wagons, 21 percent are vans or sport utility vehicles and 19 percent are light trucks.",[1 1 0 1 0],3,"Of personal vehicles, 57 percent are cars or station wagons, 21 percent vans or SUVs, 19 percent light trucks.",[1 1 0 0 0],2,1,-1,3
910,"Network security products maker Secure Computing Inc. said Tuesday it is acquiring content-filtering vendor N2H2 for $20 million, furthering consolidation in an already-competitive market.",[0 0 0 1 0],1,"Network security products maker Secure Computing said Tuesday it is acquiring content filtering firm N2H2 for $20 million, furthering consolidation in an already competitive market.",[0 0 0 0 0],0,1,1,3
916,"The Senate majority leader, Bill Frist, Republican of Tennessee, said he hoped Congress would finish work on the legislation by the end of September.",[0 0 0 1 1],2,"The Senate majority leader, Bill Frist, R-Tenn., said he hoped Congress would finish work on the legislation by late September.",[0 0 0 1 0],1,1,1,4
919,"""The risk of inflation becoming undesirably low remains the predominant concern for the foreseeable future,"" the Fed said in a statement accompanying the unanimous decision.",[1 1 0 0 0],2,"""The risk of inflation becoming undesirably low remains the predominant concern for the foreseeable future,"" the policy-setting Federal Open Market Committee said.",[0 1 0 0 0],1,1,1,0
922,"""He would often call me for advice,"" said Ronald L. Kuby, a friend and well-known lawyer who had represented him in the harassment case.",[1 0 0 0 0],1,"""He would often call me for advice,"" said lawyer Ron Kuby, a friend who had represented him in court.",[0 0 0 0 0],0,1,1,0
928,A public comment period on the proposed new taxes will end on Monday.,[1 1 1 0 0],3,The comment period was to have expired on Monday.,[1 1 0 0 0],2,1,-1,2
940,"""The Matrix Reloaded,"" which opened in limited previews Wednesday night, took in an estimated $135.8 million for all five days.",[1 1 0 0 1],3,"Matrix Reloaded opened in limited previews Wednesday night, and its total for all five days was estimated at $135.8 million.",[1 1 0 0 0],2,1,1,4
943,"The Bank of England ""requires growth from elsewhere in the economy and needs the economy to rebalance,"" he told the Press Association news agency.",[0 0 0 1 0],1,"""The bank requires growth from elsewhere in the economy and needs the economy to rebalance,"" he said in an interview with the Press Association news agency.",[0 0 0 0 0],0,1,-1,3
944,"Voters in Cleveland Heights, Ohio, were asked to decide whether to allow same-sex couples - and also unmarried heterosexual couples - to officially register as domestic partners.",[0 1 0 0 0],1,"Voters in Cleveland Heights, Ohio, approved a proposal allowing same-sex couples -- and also unmarried heterosexual couples -- to officially register as domestic partners.",[0 0 0 0 0],0,1,1,1
957,"SARS, the deadly respiratory disease first detected in China last November, gave the agency its first real test of a new state-of-the-art emergency operations center.",[1 1 0 0 1],3,"And SARS, the deadly respiratory disease first detected in China last November, tested the agency's new state-of-the-art emergency operations center.",[1 0 0 0 1],2,1,1,1
958,"Speaking to reporters at a New York news conference, Universal McCann's Coen projected that total U.S. ad spending will rise 4.6 percent to $247.7 billion this year.",[0 0 0 1 0],1,"This morning, at UM's New York office, Coen revised his expectations downward, saying that spending would instead rise 4.6 percent to $247 billion.",[0 0 0 0 0],0,1,-1,3
960,"Massachusetts has no state death penalty, and only once before -- in Michigan -- has the federal death penalty been given in a state without capital punishment.",[1 0 0 1 0],2,"Massachusetts does not have a state death penalty, and only once before - in Michigan - has the federal death penalty been given in a state without capital punishment.",[1 0 0 0 0],1,1,-1,3
963,"The 14-year-old national spelling finalist who attends school in Belmont, N.C., got a word that sounded like ""zistee"" during competition Wednesday.",[0 0 1 0 0],1,"Tom Kasmer, a 14-year-old from Belmont, N.C., got a word that sounded like ""zistee"" during yesterday's competition.",[0 0 0 0 0],0,1,-1,2
966,"The technology-laced Nasdaq Composite Index <.IXIC> declined 25.78 points, or 1.56 percent, to 1,627.84.",[1 1 1 0 0],3,"The technology-laced Nasdaq Composite Index .IXIC was down 27.13 points, or 1.64 percent, at 1,626.49, based on the latest data.",[1 1 0 0 0],2,1,-1,2
967,"GeCAD, founded in 1992 and based in Bucharest, provides anti-virus, anti-spam and content-filtering products under the name RAV AntiVirus.",[1 1 0 0 1],3,"Privately-held GeCAD Software, founded in 1992, has supplied antivirus and security products since 1994 under the name RAV AntiVirus.",[1 1 0 0 0],2,1,-1,4
