,sent_src,score_src,sum_src,sent_tgt,score_tgt,sum_tgt,score_diff,sum_diff,diff_pos
970,"More than 1,000 people rallied over three days, proclaiming that genetically modified foods weren't the answer to the world's food problems.",[0 1 0 0 0],1,"More than 1,000 people staged mostly peaceful protests during the talks, proclaiming that genetically modified foods weren't the answer to the world's food problems.",[0 0 0 0 0],0,1,-1,1
973,"Yehuda Abraham, a 76-year-old jeweler from New York's diamond district, accepted a $30,000 down payment on behalf of Lakhani for the first missile, investigators said.",[1 0 0 0 0],1,"Yehuda Abraham, a 76-year-old jeweler in New York's diamond district, allegedly accepted a $30,000 down payment on behalf of Lakhani for the missiles, the government said.",[0 0 0 0 0],0,1,-1,0
976,"""After what happened here ... it's tacky and unpatriotic,"" said JoAnn Marquis, visiting the site with her husband from Salem, Mass.",[0 0 0 1 0],1,"""It's nasty,"" said JoAnn Marquis, visiting with her husband from Salem, Mass.""After what happened here .",[0 0 0 0 0],0,1,1,3
980,"Sir Jeremy Greenstock, the UK's ambassador to the UN, is due to lead a week-long Security Council mission to West Africa in mid-May.",[0 1 0 0 1],2,"The British ambassador to the United Nations, Sir Jeremy Greenstock, is scheduled to lead a Security Council Mission to the region in mid-May.",[0 1 0 0 0],1,1,-1,4
1001,"Upscale department store chain Nordstrom Inc. (nyse: JWN - news - people) jumped $1.49, or 9.4 percent, to $17.35.",[1 1 1 0 0],3,"Upscale department store chain Nordstrom Inc. JWN.N jumped $1.49, or 9.4 percent, to $17.35.",[1 1 0 0 0],2,1,1,2
1008,"The church's lawyer, Shirley Phelps-Roper, was clear: ""What they have done is a thinly veiled attempt to do an end run around the constitution,"" she said.",[1 0 0 1 0],2,"""What they have done is a thinly veiled attempt to do an end run around the Constitution,"" she said.",[0 0 0 1 0],1,1,-1,0
1011,"Pat Anderson, the attorney representing the parents, Bob and Mary Schindler, declined to comment.",[1 0 0 0 1],2,"Pat Anderson, the lawyer representing the Schindlers, declined to comment on the filing.",[0 0 0 0 1],1,1,1,0
1018,"Hewlett-Packard Co. (nyse: HPQ - news - people), the No. 2 computer maker, rose 41 cents, or 2.4 percent, to $17.29.",[1 1 1 0 1],4,"Hewlett-Packard Co. HPQ.N , the No. 2 computer maker, rose 41 cents, or 2.4 percent, to $17.29.",[1 1 0 0 1],3,1,-1,2
1020,"Taher, acting against his attorney's advice, became the fifth member of a group of six Yemeni-Americans to enter a plea agreement with the government in the case.",[1 1 0 0 1],3,"Taher, acting against his attorney's advice, became the fifth member of the six to enter a plea agreement with the government.",[0 1 0 0 1],2,1,1,0
1024,"""Rendezvous has been a TIBCO mark for many years and is one of our flagship products,"" said George Ahn, chief marketing officer, Tibco.",[0 0 0 1 0],1,"Tibco's chief marketing officer George Ahn said: ""Rendezvous has been a Tibco mark for many years and is one of our flagship products.",[0 0 0 0 0],0,1,1,3
1025,"But Miami is competing with eight other cities, including Atlanta; Panama City; Port-of-Spain, Trinidad; and Cancn, Mexico.",[1 0 0 0 0],1,"Several cities are competing for the headquarters, including Miami; Panama City; Atlanta; Port-of-Spain, Trinidad; and Puebla, Mexico.",[0 0 0 0 0],0,1,-1,0
1028,"His wife, Janet, said she heard the thud from the kitchen, where she was getting a glass of water.",[1 0 0 0 0],1,"Janet Racicot heard the thud from the kitchen, where she was getting a glass of water, she said in an interview Tuesday.",[0 0 0 0 0],0,1,-1,0
1029,"But as time passed and more people were shot, Moose had to admit that he couldn't give the public what it needed most from the police - safety.",[0 1 0 1 0],2,"But as more people were shot, Moose had to admit that he couldn't give the public the safety it needed.",[0 1 0 0 0],1,1,-1,3
1031,"The seal will ultimately be used on department materials, signage, credentials, badges, vehicles, sea vessels and aircraft.",[1 1 0 0 0],2,"The seal will ultimately be used to identify DHS badges, vehicles, signs, sea vessels and aircraft.",[0 1 0 0 0],1,1,-1,0
1032,"An airplane carrying Spanish peacekeepers back from Afghanistan crashed into a fog-shrouded mountain in Turkey and exploded Monday, killing all 75 people aboard.",[0 1 0 0 0],1,"A charter plane crashed in Turkey on Monday, killing all 75 people aboard, including 62 Spanish peacekeepers returning from Afghanistan, officials said.",[0 0 0 0 0],0,1,1,1
1037,"Spansion products are to be available from both AMD and Fujitsu, AMD said.",[1 1 0 1 0],3,Spansion Flash memory solutions are available worldwide from AMD and Fujitsu.,[1 1 0 0 0],2,1,1,3
1039,"Rambus Inc. (nasdaq: RMBS - news - people) shot up 38 percent, making it the biggest percentage gainer on the Nasdaq.",[1 1 1 0 0],3,"Rambus Inc. shot up almost 33 percent, making it the biggest percentage gainer on the Nasdaq.",[1 1 0 0 0],2,1,1,2
1048,The decomposed remains of 17-year-old Max Guarino of Manhattan were found floating near City Island April 25.,[1 1 1 0 0],3,"Max Guarino, 17, was found April 25 in the water off City Island.",[1 1 0 0 0],2,1,1,2
1050,"The man, Fazul Abdullah Mohammed, a Comoros islander, is on the U.S. FBI's list of most wanted suspects.",[1 1 0 0 1],3,"A Comoros islander, he is on the United States' list of most wanted suspects.",[1 1 0 0 0],2,1,1,4
1064,"Overture generates its search listings from more than 100,000 advertisers who bid for placement on keywords relevant to their business.",[1 1 0 0 0],2,"Overture's listings are generated by more than 100,000 advertisers who bid for placement on keywords relevant to their business.",[1 0 0 0 0],1,1,-1,1
1075,"While Montgomery was one of the first to enact such a law, it's now relatively common - even New York City bans smoking in bars.",[1 1 0 1 0],3,"Montgomery was one of the first places to enact such a law, but many places, including New York City, now ban smoking in bars.",[1 1 0 0 0],2,1,-1,3
1086,"""We believe that it is not necessary to have a divisive confirmation fight,"" Daschle of South Dakota wrote the Republican president.",[0 0 0 1 0],1,"""We believe that it is not necessary to have a divisive confirmation fight over a Supreme Court appointment.",[0 0 0 0 0],0,1,-1,3
1088,"The blue-chip Dow Jones industrial average .DJI edged down 28.08 points, or 0.3 percent, at 9,256.49.",[1 1 1 0 0],3,"The Dow Jones industrial average closed down 18.06, or 0.2 per cent, at 9266.51.",[1 1 0 0 0],2,1,1,2
1094,"We need to challenge old habits and seriously rethink business-as-usual,"" he wrote.",[0 0 0 1 0],1,"""We need to change old habits and seriously rethink business-as-usual.""",[0 0 0 0 0],0,1,1,3
1095,Grass is the second of the Rite Aid defendants to strike a deal with federal prosecutors this month.,[0 1 0 0 0],1,The plea makes Grass the second high-ranking Rite Aid executive to strike a deal with federal prosecutors in the past two weeks.,[0 0 0 0 0],0,1,-1,1
1096,Class-action suits expand exponentially the number of plaintiffs and damages in a lawsuit by allowing initial plaintiffs to plea on behalf of a far larger group with common interest.,[1 1 0 0 0],2,Class-action suits expand sharply the number of plaintiffs and damages in a suit by allowing initial plaintiffs to sue on behalf of a larger group with common interests.,[1 0 0 0 0],1,1,1,1
1101,A sour forecast from Sun Microsystems Inc.SUNW.O put more pressure on Wall Street before the quarterly earnings season.,[1 1 0 0 0],2,"Tech stocks were hurt by a sour forecast from Sun Microsystems, which was viewed as a bad omen for the upcoming quarterly earnings season.",[1 0 0 0 0],1,1,-1,1
1102,"Culturecom is confident it will make a significant impact on market share with this new development,"" Frank Cheung, chairman of Culturecom, said in a statement.",[0 0 0 1 0],1,"He added: ""Culturecom is confident it will make a significant impact on market share with this new development.""",[0 0 0 0 0],0,1,1,3
1105,"Many compensation experts had predicted that Carty would get a generous severance package because his voluntary resignation helped preserve the concessions, the Fort Worth Star-Telegram reported.",[0 0 0 1 0],1,Many compensation experts had predicted Carty would get a generous severance deal because his voluntary resignation helped keep the concessions deals in place.,[0 0 0 0 0],0,1,-1,3
1107,"Near a mosque in the northern town of Mosul, rebel gunmen also assassinated a Sunni Muslim tribal leader who backed the coalition.",[0 0 0 1 0],1,"Also in Mosul, rebel gunmen on Friday assassinated a Sunni Muslim tribal leader who backed the coalition.",[0 0 0 0 0],0,1,-1,3
1116,"An Iranian Kurd who stitched up his eyes, lips and ears in protest at being refused asylum has been granted refugee status.",[0 1 0 0 1],2,"The Iranian refugee who sewed up his eyes, lips and ears in protest at the handling of his asylum claim has won his fight to remain in Britain.",[0 0 0 0 1],1,1,-1,1
1117,He was joined by Chief Justice William H. Rehnquist and Justices Antonin Scalia and Clarence Thomas.,[1 0 0 0 0],1,Justice Anthony Kennedy dissented in an opinion joined by Chief Justice William Rehnquist and Justices Antonin Scalia and Clarence Thomas.,[0 0 0 0 0],0,1,-1,0
1119,The stretch of Danube river passing through the Balkans dropped so low that wrecks of World War II boats became visible.,[1 1 1 0 0],3,Rivers were also drying up - a stretch of Danube passing through the Balkans dropped so low that wrecks of World War II boats became visible.,[1 1 0 0 0],2,1,1,2
1121,Rep. Dennis Kucinich of Ohio is expected to raise more than $1 million.,[0 1 0 0 0],1,Ohio Rep. Dennis Kucinich passed $1 million last week and was still counting money.,[0 0 0 0 0],0,1,1,1
1123,"After protesters rushed the stage and twice cut power to the microphone, Hedges cut his speech short.",[0 1 0 1 0],2,"After protesters rushed the stage and twice cut power to the microphone, Hedges drew the speech to an early close.",[0 0 0 1 0],1,1,-1,1
1127,The Legislature returns today for a special session and they're expected to pass a compromise bill aimed at lowering doctors' medical malpractice insurance rates.,[1 1 0 0 0],2,Florida legislators return today for a special session in which they're expected to pass a compromise bill aimed at lowering doctors' medical malpractice insurance rates.,[0 1 0 0 0],1,1,1,0
1131,"""SCO has not shown us any evidence that we've violated our agreements in any way,"" IBM spokesperson Trink Guarino told internetnews.com.",[0 0 0 1 0],1,"""SCO has not shown us any evidence that we violated our agreements,"" spokeswoman Trink Guarino said.",[0 0 0 0 0],0,1,1,3
1132,"Lawrence E. Alibozek, his former deputy chief of staff, pleaded guilty to accepting cash and gold coins in exchange for influencing state contracts.",[0 0 0 0 1],1,"In March, Rowland's former deputy chief of staff pleaded guilty to accepting gold and cash in return for steering state contracts.",[0 0 0 0 0],0,1,-1,4
1147,"No country seems likely to oppose proposals for a long-term European Council president, replacing the current rotating presidency, as well as an EU foreign minister.",[0 1 0 0 0],1,"No country now opposes plans for a long-term European Council president, replacing the current rotating presidency, as well as an EU foreign minister.",[0 0 0 0 0],0,1,1,1
1155,"""During the investigation, Bryant was cooperative with investigators and remains cooperative with authorities,"" the sheriff's office said.",[0 0 0 1 0],1,"Bryant was ""interviewed and was cooperative,"" said Kim Andree, a spokeswoman for the sheriff's office.",[0 0 0 0 0],0,1,1,3
1162,"Quattrone's action, prosecutors argue, amounted to criminal obstruction of justice.",[1 1 0 0 0],2,"Quattrone, 47, is charged with obstruction of justice and witness tampering.",[0 1 0 0 0],1,1,1,0
1163,SEA 05D is the Naval Sea Systems Command’s technical authority for surface ship design and engineering.,[1 1 0 0 0],2,The Future Concepts and Surface Ship Design Group is the Naval Sea Systems Command’s technical authority for all surface ship design and engineering.,[0 1 0 0 0],1,1,1,0
1165,"The airline has the option to buy 380 more, split evenly between the two manufacturers.",[0 1 0 0 0],1,"The airline also said it has the option to buy 380 more airplanes, orders that would be split evenly between the two manufacturers.",[0 0 0 0 0],0,1,-1,1
1169,"Mr Kenny and the Hicks family's American lawyer, Michael Ratner, are trying to get access to Mr Hicks before he faces a planned military tribunal.",[0 0 1 0 0],1,"Mr Kenny and the family's American lawyer, Michael Ratner, want access to Hicks before he faces a military tribunal.",[0 0 0 0 0],0,1,1,2
1172,Treasurys long-range plan is to provide retail buyers of all Treasury securities the ability to manage their holdings online in a single account.,[1 1 0 0 0],2,The Treasury said wants to give retail buyers of all Treasury securities the ability eventually to manage holdings online in a single account.,[0 1 0 0 0],1,1,1,0
1177,"Roxio, which is based in Santa Clara, Calif., would get access to the music libraries of the major labels and the Pressplay distribution system.",[1 1 0 0 1],3,"Roxio, would get access to more than 300,000 tracks from the music libraries of the major labels, and the Pressplay distribution system.",[1 1 0 0 0],2,1,1,4
1185,"Quattrone, 47, was highly influential at Credit Suisse First Boston during the tech bubble.",[0 1 0 0 0],1,"Quattrone, 47, was highly influential working in the Palo Alto office of Credit Suisse First Boston during the tech bubble.",[0 0 0 0 0],0,1,1,1
1190,Passengers on that cruise are to be given a refund and voucher for another trip.,[0 1 0 0 0],1,"Passengers would be given a refund and voucher for another trip, she said.",[0 0 0 0 0],0,1,-1,1
1195,Federal regulators have turned from sour to sweet on a proposed $2.8 billion merger of ice cream giants Nestle Holdings Inc. and Dreyer's Grand Ice Cream Inc.,[1 0 0 0 0],1,Federal regulators have changed their minds on a proposed $2.8 billion merger of ice cream giants Nestle Holdings and Dreyer's Grand Ice Cream.,[0 0 0 0 0],0,1,1,0
1204,"""The United States welcomes a greater NATO role in Iraq's stabilization,"" Mr. Powell told his colleagues in a speech today.",[0 0 0 1 0],1,"""The United States welcomes a greater NATO role in Iraq's stabilization,"" Powell said.",[0 0 0 0 0],0,1,-1,3
1214,"At the Pentagon, the Department of Defense's Inspector General has separately been asked to investigate how the telecom licences were awarded.",[0 1 0 0 0],1,But a source close to the Pentagon said the Defense Department's own inspector-general had been asked to investigate how the licences were awarded.,[0 0 0 0 0],0,1,1,1
1232,"On the upside, Coca-Cola Co. (nyse: KO - news - people) reported higher profit for the quarter early on Thursday, helped by European demand.",[1 1 1 0 0],3,"Coca-Cola Co. (KO) reported higher profit for the quarter, helped by European demand, early on Thursday.",[1 1 0 0 0],2,1,1,2
1235,"They made a similar discovery in Houston on another aircraft, Dallas-based Southwest said in a statement.",[0 1 0 0 0],1,The airline said a similar discovery was made on the plane in Houston.,[0 0 0 0 0],0,1,1,1
1236,"Mr. Spitzer said in a statement that the sentence ""reflects the seriousness with which our office and the courts view these crimes.""",[0 1 0 0 0],1,"""The sentence reflects the seriousness with which our office and the courts views these crimes,"" Spitzer said in a statement.",[0 0 0 0 0],0,1,-1,1
1245,"There are no plans to build permanent U.S. bases in Africa, Defense Department officials say.",[0 0 0 1 0],1,"There were no plans to build permanent US bases in Africa, Pentagon officials said.",[0 0 0 0 0],0,1,-1,3
1246,"Sarah Weddington, the abortion advocate and attorney who originally represented McCorvey, could not be reached for comment.",[0 1 0 0 1],2,"Sarah Weddington, the abortion advocate and lawyer who originally represented McCorvey, did not immediately return a call seeking comment.",[0 0 0 0 1],1,1,1,1
1248,"The Justice Department's Office of the Inspector General described ""significant problems"" in the Bush administration's actions toward the 762 foreigners held on immigration violations after the attacks.",[1 1 1 0 0],3,"The report by the Justice Department's inspector general found ""significant problems"" in the government's handling of foreigners who were jailed under blanket edicts adopted by the department after the attacks.",[0 1 1 0 0],2,1,-1,0
1249,"Under the proposed stock for stock transaction, LendingTree shareholders will get 0.6199 shares of USAI common stock for each share of LendingTree common stock.",[1 0 0 0 0],1,"Under the agreement, LendingTree shareholders would receive 0.6199 of a USAi share for each share in LendingTree.",[0 0 0 0 0],0,1,-1,0
1251,"Greenspan's Federal Reserve, the U.S. central bank, decides interest rates in the world's largest economy.",[1 1 0 0 0],2,"Greenspan is head of the U.S. central bank, which sets U.S. interest rates.",[0 1 0 0 0],1,1,-1,0
1252,"Others rushed up the aisle to vocally protest the remarks, and one student tossed his cap and gown to the stage before leaving.",[0 1 0 0 0],1,"A few tried to rush the podium, and at least one graduate tossed his cap and gown to the stage before leaving.",[0 0 0 0 0],0,1,1,1
1254,"""Iran should be on notice that attempts to remake Iraq in Iran's image will be aggressively put down,"" he said.",[0 0 0 1 0],1,"""Indeed, Iran should be put on notice that efforts to try to remake Iraq in their image will be aggressively put down,"" he said.",[0 0 0 0 0],0,1,-1,3
1255,"It is important for a process to be put into place, he said, that would permit a smooth transition from war to peace.",[1 0 0 0 0],1,"He added: ""Let the process be put in place that will ensure a smooth transition from war to peace.",[0 0 0 0 0],0,1,1,0
1257,"""If I was diagnosed today with CJD, I would ensure I received this treatment as soon as humanly possible.",[1 0 0 0 0],1,"He added that if he were diagnosed with vCJD ""I would ensure I received this treatment as soon as humanly possible"".",[0 0 0 0 0],0,1,1,0
1266,"""This new division will be focused on the vitally important task of protecting the nation's cyberassets so that we may best protect the nation's critical infrastructure assets,"" he added.",[0 0 0 1 0],1,"""This new division will be focused on the vitally important task of protecting the nation's cyber assets so that we may best protect the nation’s critical infrastructure assets.""",[0 0 0 0 0],0,1,-1,3
1272,"""The court expects that 25 years from now, the use of racial preferences will no longer be necessary,"" O'Connor wrote.",[0 0 0 1 0],1,"O'Connor wrote, ""We expect that 25 years from now, the use of racial preferences will no longer be necessary.""",[0 0 0 0 0],0,1,1,3
1277,"In afternoon trading in Europe, France's CAC-40 rose 1.5 percent, Britain's FTSE 100 gained 0.3 percent and Germany's DAX index advanced 1.2 percent.",[1 1 0 1 0],3,"In afternoon trading in Europe, France's CAC-40 advanced and Britain's FTSE 100 each gained 0.7 percent, while Germany's DAX index rose 0.6 percent.",[1 1 0 0 0],2,1,1,3
1280,"As such, consumers want to easily enjoy this content, regardless of the source, across different devices and locations in the home, said the group.",[0 0 0 1 0],1,"The companies say their consumers want to enjoy their content, regardless of the source, across different devices and locations in the home.",[0 0 0 0 0],0,1,1,3
1293,"The blue-chip Dow Jones industrial average <.DJI> slipped 44.32 points, or 0.48 percent, to 9,240.25.",[1 1 1 0 0],3,"The Dow Jones industrial average closed down 18.06, or 0.2 per cent, at 9266.51.",[1 1 0 0 0],2,1,-1,2
1296,"""We will accede to the request while we explore all of our options,"" VeriSign spokesman Tom Galvin told Reuters.",[0 0 0 1 0],1,"We will accede to the request while we explore all of our options,"" said Russell Lewis, executive vice president of VeriSign's Naming and Directory Services Group.",[0 0 0 0 0],0,1,1,3
1297,"In a regulatory filing, EDS said the SEC had asked for information related to its troubled IT outsourcing contract with the US Navy.",[1 1 0 0 0],2,Electronic Data Systems Corp. Thursday said the Securities and Exchange Commission has asked the company for documents related to its large contract with the U.S. Navy.,[1 0 0 0 0],1,1,-1,1
1302,"A year or two later, 259, or 10 per cent, of the youths reported that they had started to smoke, or had taken just a few puffs.",[1 0 0 1 0],2,"Within two years, 259, or 10 percent, of the youths reported they had started to smoke or had at least taken a few puffs.",[1 0 0 0 0],1,1,1,3
1305,Officials with North Carolina Speedway at Rockingham could not be reached.,[1 1 0 0 0],2,NASCAR officials could not be reached for comment Tuesday.,[0 1 0 0 0],1,1,1,0
1307,Chief Justice William Rehnquist and Justice Clarence Thomas were the two other dissenting judges.,[1 1 0 0 0],2,His dissent was joined by Chief Justice William H. Rehnquist and Justice Clarence Thomas.,[1 0 0 0 0],1,1,1,1
1312,"""The United States welcomes a greater NATO role in Iraq's stabilisation,"" Powell said, according to the text of prepared remarks seen by Reuters.",[1 0 0 0 0],1,"""The United States welcomes a greater NATO role in Iraq's stabilization,"" Mr. Powell said in a speech to fellow NATO ministers.",[0 0 0 0 0],0,1,1,0
1318,"""It's obvious I'm not riding as well as years past,"" Armstrong said at a news conference.",[0 0 0 1 0],1,"""I think it's obvious I'm not riding as well as I have in years past.",[0 0 0 0 0],0,1,1,3
1319,One of those infected reported having recent contact with exotic animals there.,[1 1 0 0 0],2,All those infected had recent close contact with prairie dogs.,[0 1 0 0 0],1,1,-1,0
1327,"The blue-chip Dow Jones industrial average .DJI added 38 points, or 0.42 percent, to 9,165.",[1 1 1 0 0],3,"The Dow Jones industrial average .DJI ended up 64.64 points, or 0.71 percent, at 9,191.09, according to the latest available data.",[1 1 0 0 0],2,1,-1,2
1337,"Detective Chief Inspector Norman McKinlay, leading the investigation, said: ""There is evidence a body or bodies have been in this area.",[0 0 0 1 0],1,"Det Chief Insp Norman McKinlay said there was ""evidence a body or bodies have been in this area"".",[0 0 0 0 0],0,1,-1,3
1338,"FCC Chairman Michael Powell said in a statement that the ruling would ""throw a monkey wrench into the FCC's efforts to develop a vitally important national broadband policy.""",[0 1 0 0 0],1,"He added that the decision will ""throw a monkey wrench into the FCC's efforts to develop a vitally important national broadband policy.""",[0 0 0 0 0],0,1,1,1
1339,"Mortgage rates around the country fell again this week, the ninth time this year rates have hit an all-time low.",[0 1 0 0 0],1,It marked the fourth straight week and the ninth time this year that rates on this benchmark mortgage fell to an all-time weekly low.,[0 0 0 0 0],0,1,-1,1
1341,"Then they moved inside the mosque and started firing on the people,'' he told the Associated Press.",[0 0 0 1 0],1,"""Then they moved inside the mosque and started firing on the people.""",[0 0 0 0 0],0,1,1,3
1342,The company is in the early stages of testing the drug for rheumatoid arthritis.,[0 1 0 0 0],1,The company is also testing its cancer drug Rituxan for use by rheumatoid arthritis patients.,[0 0 0 0 0],0,1,1,1
1344,"Several relatives of Australian victims of the attack sat in the front row of the court, but few Balinese attended the trial.",[1 1 0 0 0],2,"Several relatives of Australian victims of the attack were in court to witness the proceedings, but few Balinese attended the trial.",[0 1 0 0 0],1,1,-1,0
1351,Qualcomm has enjoyed many years of selling CDMA chips against little or no competition.,[1 0 0 0 0],1,"""Qualcomm has enjoyed many years of selling...against little or no competition,"" Hubach said in the statement.",[0 0 0 0 0],0,1,1,0
1364,"Intel said midway through its quarter, which ended in June, that business was exactly as expected.",[1 1 0 1 0],3,Intel updated investors midway through the quarter and said business was proceeding exactly as planned.,[1 1 0 0 0],2,1,-1,3
1366,"""No data exists to indicate that the situation with repair stations poses a safety concern.""",[0 1 0 0 0],1,"However, FAA spokeswoman Kathleen Bergen said no data indicate that the situation poses safety problems.",[0 0 0 0 0],0,1,1,1
1373,"Mohcine Douali, who lives in the centre of Algiers, said: ""It was a great shock.",[0 0 0 0 1],1,"""It was a great shock,"" said Mohcine Douali, who lives in central Algiers.",[0 0 0 0 0],0,1,1,4
1381,"In a 1992 case, the Supreme Court reaffirmed the basic findings of Roe protecting abortion choice, but lessened the standards of protection guaranteed to women by Roe.",[1 1 0 0 0],2,The court's 1992 decision reaffirmed the basic findings of Roe protecting abortion choice but lessened the standards of protection guaranteed to women by Roe.,[0 1 0 0 0],1,1,-1,0
1383,"More than 60 per cent of its 1,000 employees at the time were killed.",[1 1 1 0 0],3,"More than 60 percent of the company's 1,000 employees were killed in the attack.",[0 1 1 0 0],2,1,-1,0
1386,"However, one subset of patients, women on hormonal treatment following chemotherapy, ""appeared to show a favorable trend to improvement in survival.""",[1 1 0 0 1],3,"However, one subset of women — those on hormonal treatment following chemotherapy — appeared to show improvement in survival.",[0 1 0 0 1],2,1,-1,0
